{
  "id": "moderately-armored",
  "name": "Protection intermédiaire",
  "source": "phb-fr",
  "narratif": true,
  "status": {
    "provisoire": true,
    "raison": "nom et provenance seulement : aucun mécanisme de don n'existe encore dans le moteur",
    "retraitSi": "le LOT-13 a livré la fiche et les mécanismes que ce don exige, et l'effet est décrit en `mecanismesRequis`"
  },
  "variantes": [
    "Modérément protégé"
  ]
}
